{
  "protocol": "tokenless.internal.web-ai-interaction-protocol/v0",
  "requestRef": "request:00000000000000000000000000000000",
  "providerRef": "provider:11111111111111111111111111111111",
  "providerBindingRef": "binding:22222222222222222222222222222222",
  "requiredCapabilities": ["conversation.chat", "file.upload", "document.input"],
  "conversation": { "mode": "new" },
  "bootstrap": {
    "text": "Summarize the supplied material.",
    "attachments": [{
      "kind": "system_prompt",
      "name": "tokenless-system-prompt.md",
      "attachmentRef": "attachment:55555555555555555555555555555555",
      "mediaType": "text/markdown",
      "byteLength": 42,
      "sha256": "d30f5f0bcb4a8d96f338fbb6df50e0fe9ea5383688e2c1b9d4bbbf5f5be664cc"
    }, {
      "kind": "skill",
      "name": "tokenless-skill--legal-writing--d30f5f0bcb4a.md",
      "attachmentRef": "attachment:66666666666666666666666666666666",
      "mediaType": "text/markdown",
      "byteLength": 42,
      "sha256": "d30f5f0bcb4a8d96f338fbb6df50e0fe9ea5383688e2c1b9d4bbbf5f5be664cc"
    }]
  }
}
